graph,question,answer
text-to-image-generation-on-coco,"Which model achieves 7.27 FID on COCO text-to-image generation?",Imagen
visual-question-answering-on-vqa-v2-test-dev,"Which paper claims to achieve human parity on visual question answering for VQA v2 test-dev?",Achieving Human Parity on Visual Question Answering
visual-question-answering-on-vqa-v2-test-dev,"What's the reported Accuracy of the MMU model on the VQA v2 test-dev dataset?",81.26
visual-question-answering-on-vqa-v2-test-dev,"How many models are reported in recent VQA v2 test-dev papers?",1
weakly-supervised-object-detection-on-pascal-1,"Which paper proposes an instance-aware, context-focused, and memory-efficient method for weakly supervised object detection on PASCAL VOC?","Instance-aware, Context-focused, and Memory-efficient Weakly Supervised Object Detection"
weakly-supervised-object-detection-on-pascal-1,"What approach aims for a precise end-to-end weakly supervised object detection network on PASCAL VOC?",Towards Precise End-to-end Weakly Supervised Object Detection Network
weakly-supervised-object-detection-on-pascal-1,"Which paper introduces object instance mining for weakly supervised object detection on PASCAL VOC?",Object Instance Mining for Weakly Supervised Object Detection
weakly-supervised-object-detection-on-pascal-1,"What method uses PSNet and box regression for WSOD on PASCAL VOC?",WSOD with PSNet and Box Regression
weakly-supervised-object-detection-on-pascal-1,"What's the highest reported MAP for weakly-supervised object detection on PASCAL VOC?",58.1
